{"air":{"context_flow":[{"context_type_ref":"ConversationContext","from_node":"ConversationalExample.cond.16","to_node":"ConversationalExample.yield.19","value_id":"ConversationalExample.context.18"}],"schema_version":"apxm.air","semantic_operations":[{"execution_order":500000,"node_id":"ConversationalExample.tool_invocation.9","op":"capability.invoke","operands":[{"slot":"capability_ref","type_ref":"CapabilityRef","value_id":"search_web"},{"slot":"arguments","type_ref":"ArgumentValue","value_id":"ConversationalExample.value.11"}],"parent_region_id":"ConversationalExample.cond.8.then","result":{"type_ref":"ToolOutput","value_id":"ConversationalExample.value.10"}},{"execution_order":1500000,"node_id":"ConversationalExample.model_invocation.12","op":"model.call","operands":[{"slot":"model_ref","type_ref":"ModelTargetRef","value_id":"model.target"},{"slot":"request","type_ref":"ArgumentValue","value_id":"ConversationalExample.value.14"}],"parent_region_id":"ConversationalExample.cond.8.then","result":{"type_ref":"ModelResponse","value_id":"ConversationalExample.value.13"}},{"execution_order":500000,"node_id":"ConversationalExample.model_invocation.3","op":"model.call","operands":[{"slot":"model_ref","type_ref":"ModelTargetRef","value_id":"model.target"},{"slot":"request","type_ref":"ArgumentValue","value_id":"ConversationalExample.value.5"}],"parent_region_id":"ConversationalExample.loop.1.body","result":{"type_ref":"ModelResponse","value_id":"ConversationalExample.value.4"}}],"source_map":{"node_spans":[{"node_id":"ConversationalExample.model_invocation.3","semantic_annotation":"model_invocation","source_file":"examples/agents/conversational/python/agent.py","span":{"end_column":9,"end_line":10,"start_column":25,"start_line":8}},{"node_id":"ConversationalExample.tool_invocation.9","semantic_annotation":"tool_invocation","source_file":"examples/agents/conversational/python/agent.py","span":{"end_column":84,"end_line":14,"start_column":36,"start_line":14}},{"node_id":"ConversationalExample.model_invocation.12","semantic_annotation":"model_invocation","source_file":"examples/agents/conversational/python/agent.py","span":{"end_column":17,"end_line":21,"start_column":33,"start_line":15}},{"node_id":"ConversationalExample.yield.19","semantic_annotation":"yield","source_file":"examples/agents/conversational/python/agent.py","span":{"end_column":56,"end_line":33,"start_column":25,"start_line":33}}],"region_annotations":[{"annotation":"structural_loop","region_id":"ConversationalExample.loop.1.body"},{"annotation":"structural_loop","region_id":"ConversationalExample.loop.6.body"}],"schema_version":"apxm.source-map","source_language":"python"},"structural_ir":[{"block_arguments":[{"type_ref":"ConversationInput","value_id":"ConversationalExample.param.input"},{"type_ref":"ModelTargetRef","value_id":"model.target"},{"type_ref":"CapabilityRef","value_id":"search_web"}],"execution_order":500000,"kind":"function","region_id":"ConversationalExample.body"},{"block_arguments":[{"type_ref":"ConversationInput","value_id":"ConversationalExample.value.2"}],"execution_order":2500000,"kind":"ais.loop","operands":[{"slot":"initial","type_ref":"ConversationInput","value_id":"ConversationalExample.param.input"},{"slot":"carried","type_ref":"ConversationInput","value_id":"ConversationalExample.resume.20"}],"parent_region_id":"ConversationalExample.body","predicate":{"comparator":"not_equals","literal":{"scalar_type":"string","value":""},"property_path":["message"],"root_value_id":"ConversationalExample.value.2"},"region_id":"ConversationalExample.loop.1.body"},{"execution_order":3500000,"kind":"throw","parent_region_id":"ConversationalExample.body","region_id":"ConversationalExample.throw.22"},{"execution_order":500000,"kind":"region","parent_region_id":"ConversationalExample.cond.16","region_id":"ConversationalExample.cond.16.then"},{"execution_order":500000,"kind":"throw","parent_region_id":"ConversationalExample.cond.16.then","region_id":"ConversationalExample.throw.17"},{"execution_order":500000,"kind":"region","parent_region_id":"ConversationalExample.cond.8","region_id":"ConversationalExample.cond.8.then"},{"execution_order":1500000,"kind":"region","parent_region_id":"ConversationalExample.cond.8","region_id":"ConversationalExample.cond.8.else"},{"execution_order":500000,"kind":"throw","parent_region_id":"ConversationalExample.cond.8.else","region_id":"ConversationalExample.throw.15"},{"execution_order":0,"kind":"region","parent_region_id":"ConversationalExample.cond.8.then","region_id":"hook.PrepareSearchContext"},{"execution_order":500002,"kind":"region","parent_region_id":"ConversationalExample.cond.8.then","region_id":"hook.RecordSearchContext"},{"block_arguments":[{"type_ref":"ModelResponse","value_id":"ConversationalExample.value.7"}],"execution_order":3500000,"kind":"ais.loop","operands":[{"slot":"initial","type_ref":"ModelResponse","value_id":"ConversationalExample.value.4"},{"slot":"carried","type_ref":"ModelResponse","value_id":"ConversationalExample.value.13"}],"parent_region_id":"ConversationalExample.loop.1.body","predicate":{"comparator":"equals","literal":{"scalar_type":"string","value":"tool_request"},"property_path":["kind"],"root_value_id":"ConversationalExample.value.7"},"region_id":"ConversationalExample.loop.6.body"},{"execution_order":4500000,"kind":"branch","parent_region_id":"ConversationalExample.loop.1.body","predicate":{"comparator":"not_equals","literal":{"scalar_type":"string","value":"final"},"property_path":["kind"],"root_value_id":"ConversationalExample.value.7"},"region_id":"ConversationalExample.cond.16"},{"block_arguments":[{"type_ref":"ConversationInput","value_id":"ConversationalExample.resume.20"}],"execution_order":6500000,"kind":"yield","operands":[{"slot":"output","type_ref":"ArgumentValue","value_id":"ConversationalExample.value.21"}],"parent_region_id":"ConversationalExample.loop.1.body","region_id":"ConversationalExample.yield.19"},{"execution_order":500000,"kind":"branch","parent_region_id":"ConversationalExample.loop.6.body","predicate":{"comparator":"equals","literal":{"scalar_type":"string","value":"search_web"},"property_path":["tool_request","kind"],"root_value_id":"ConversationalExample.value.7"},"region_id":"ConversationalExample.cond.8"}],"value_assemblies":[{"expression":{"fields":[{"name":"messages","value":{"kind":"context","property_path":["messages"]}},{"name":"incoming","value":{"kind":"ssa","value_id":"ConversationalExample.value.2"}}],"kind":"object"},"value_id":"ConversationalExample.value.5"},{"expression":{"kind":"projection","property_path":["tool_request","arguments"],"root":{"kind":"ssa","value_id":"ConversationalExample.value.7"}},"value_id":"ConversationalExample.value.11"},{"expression":{"fields":[{"name":"messages","value":{"kind":"context","property_path":["messages"]}},{"name":"incoming","value":{"kind":"ssa","value_id":"ConversationalExample.value.2"}},{"name":"tool_result","value":{"kind":"ssa","value_id":"ConversationalExample.value.10"}}],"kind":"object"},"value_id":"ConversationalExample.value.14"},{"expression":{"fields":[{"name":"messages","value":{"kind":"context","property_path":["messages"]}},{"name":"tool_calls","value":{"kind":"context","property_path":["tool_calls"]}},{"name":"last_reply","value":{"kind":"projection","property_path":["reply","message"],"root":{"kind":"ssa","value_id":"ConversationalExample.value.7"}}}],"kind":"object"},"value_id":"ConversationalExample.context.18"},{"expression":{"kind":"projection","property_path":["reply"],"root":{"kind":"ssa","value_id":"ConversationalExample.value.7"}},"value_id":"ConversationalExample.value.21"}]},"air_digest":"sha256:db57764c7d0c7e48db1daf77cf8609df29b812fadfce97c8fdabdb5f06207dc3","artifact_digest":"sha256:a2fae07a79aecd63c105a135c9a292fa9c402147ebd8597a2e09d0dfd56ba9c9","artifact_semantic_requirements":[{"required_feature_set":[],"required_port_contract":{"digest":"sha256:acee630095181854e1146e77d965e13aacb55c44a623e5d2f6cfffe99333697c","schema_id":"apxm.model-target"},"requirement_digest":"sha256:c83fcba85fd1995de06f508a70bb5d250fefac936a70e2f3c901dba610352a84","schema_version":"apxm.port-requirement.v1","semantic_limits_digest":"sha256:e3b0c44298fc1c149afbf4c8996fb92427ae41e4649b934ca495991b7852b855","source_digest":"sha256:d616a1c9710ab8fddf64cf4c036fc8ebfce5c7428798a32a4a3dc784d2e1549d","source_owner":"agents","source_scope":"artifact_semantic","typed_port_slot":"model.target"},{"required_feature_set":[],"required_port_contract":{"digest":"sha256:347165a958b16050a368d795564f0c63e42d6a4dc5c900bec7efa150c5de4f6b","schema_id":"apxm.capability-invocation"},"requirement_digest":"sha256:e18341068ebbe5707f0b23dfa7073296c9de9c3986180c4386bc6488deee5e18","schema_version":"apxm.port-requirement.v1","semantic_limits_digest":"sha256:e3b0c44298fc1c149afbf4c8996fb92427ae41e4649b934ca495991b7852b855","source_digest":"sha256:bb549c955bdb6a1196966ded65ac35f6350499fbc314498f02fe5a0afc0c6e4c","source_owner":"agents","source_scope":"artifact_semantic","typed_port_slot":"search_web"}],"entrypoints":[{"context_type_ref":"ConversationContext","entrypoint":"ConversationalExample","input_type_ref":"ConversationInput","output_type_ref":"ConversationOutput","program_id":"ConversationalExample"}],"hook_bindings":[{"declaration_order":0,"handler_digest":"sha256:89eaa212c23ece848ab5df2975704f0a94b1ef8d80ae4d05912ee059b3a4f055","handler_ref":"PrepareSearchContext","hook_id":"hook.PrepareSearchContext","input_type_ref":"AgentFacade","output_type_ref":"Unit","phase":"before","return_mode":"observe","scope":"capability","target_selector":"ConversationalExample.tool_invocation.9"},{"declaration_order":1,"handler_digest":"sha256:e23ab0072db3c75d490d072ae5c2f29efe4ef81af5025e63321f43b0b647e359","handler_ref":"RecordSearchContext","hook_id":"hook.RecordSearchContext","input_type_ref":"AgentFacade","output_type_ref":"Unit","phase":"after","return_mode":"observe","scope":"capability","target_selector":"ConversationalExample.t